{
  "schemaVersion": 1,
  "generatedAt": "13 July 2026, Melbourne close",
  "sourceMode": "curated-delayed",
  "items": [
    {
      "id": "sample-impact",
      "category": "Macro",
      "status": "developing",
      "eventDate": "2026-07-13",
      "timeLabel": "13 Jul 2026",
      "headline": "Sample curated market event",
      "summary": "A supplied summary with no added claims.",
      "sources": [{"name": "Example source", "url": "https://example.com/source"}],
      "interpretations": [
        {
          "assetId": "gold",
          "assetName": "Gold",
          "direction": "down",
          "magnitude": "high",
          "horizon": "unclear",
          "confidence": "unclear",
          "mechanism": "Higher yields pressure non-yielding assets.",
          "confirmation": "Confirmation condition was not specified in the legacy item.",
          "invalidation": "Yields reverse lower and gold recovers the stated level."
        }
      ],
      "channels": [{"label": "Invalidation", "detail": "Yields reverse lower and gold recovers the stated level."}],
      "legacy": {"impact": "High", "status": "Developing"}
    }
  ]
}
